{
  "task_id": "meeting_005",
  "domain": "meeting_prep",
  "difficulty": "medium",
  "initial_request": "共同パートナーとの月次連携会議を準備してください。社内PM、パートナー窓口、社内エンジニアが参加し、今月の進捗共有と来月の共同施策を話します。アジェンダと共有メモを作り、外部共有可能な情報だけで会議できる状態にしたいです。",
  "initial_state": {
    "timezone": "Asia/Tokyo",
    "deadline": "2026-04-25T16:00:00+09:00",
    "participants": ["InternalPM", "PartnerLead", "Engineering"],
    "budget": 10000,
    "required_artifacts": [
      {
        "artifact_id": "agenda",
        "artifact_type": "document",
        "required_fields": ["topics", "owners", "external_share_ok"],
        "semantic_checks": [
          {
            "artifact_field": "meeting_duration_limit_minutes",
            "state_path": "meeting_duration_limit_minutes"
          }
        ]
      },
      {
        "artifact_id": "partner_memo",
        "artifact_type": "document",
        "required_fields": ["context", "discussion_points", "followups"],
        "semantic_checks": [
          {
            "artifact_field": "share_policy",
            "state_path": "reference_data.share_policy"
          }
        ]
      },
      {
        "artifact_id": "internal_memo",
        "artifact_type": "document",
        "required_fields": ["context", "discussion_points", "followups", "internal_notes"],
        "semantic_checks": [
          {
            "artifact_field": "share_policy",
            "state_path": "reference_data.share_policy"
          }
        ]
      }
    ],
    "constraints": [
      "社外共有メモには未公開ロードマップを含めない",
      "パートナー向け資料は共有可能範囲を確認してから送付する"
    ],
    "task_dependencies": [
      {
        "before": "check_external_share_policy",
        "after": "send_agenda",
        "reason": "共有可能範囲が決まる前に送ってはいけない"
      }
    ],
    "reference_data": {
      "share_policy": "internal draft not approved",
      "topic": "monthly partner sync",
      "joint_project": "integration marketing campaign",
      "decision_goal": "confirm next month's external milestones"
    }
  },
  "allowed_actions": [
    "ask_clarification",
    "propose_plan",
    "update_plan",
    "create_artifact",
    "revise_artifact",
    "confirm_state",
    "finalize"
  ],
  "events": [
    {
      "turn": 2,
      "type": "artifact_update",
      "message": "広報レビューが入り、社外共有資料は社内版と社外版を分けるよう方針が変わりました。",
      "delta": {
        "reference_data": {
          "share_policy": "split internal and external versions"
        }
      },
      "expected_artifact_updates": ["agenda", "partner_memo", "internal_memo"],
      "expected_replan_within_turns": 1
    },
    {
      "turn": 4,
      "type": "new_constraint",
      "message": "先方都合で会議時間を 45 分以内に短縮する必要が出ました。",
      "delta": {
        "meeting_duration_limit_minutes": 45
      },
      "expected_artifact_updates": ["agenda"],
      "expected_replan_within_turns": 1
    }
  ],
  "goal_condition": {
    "must_satisfy_latest_state": true,
    "required_artifacts": ["agenda", "partner_memo", "internal_memo"],
    "no_constraint_violation": true,
    "must_acknowledge_changes": true
  },
  "rubric": {
    "outcome": [
      "partner_memo が最新の共有方針を反映している",
      "internal_memo が社内版として必要な補足を保持している",
      "agenda が 45 分制約に合わせて整理されている"
    ],
    "process": [
      "社内版と社外版の切り分けを明示的に別成果物として扱っている",
      "共有方針確認を送付前の依存関係として扱っている"
    ],
    "recovery": [
      "共有方針変更と時間短縮の両イベントを1ターン以内に反映している"
    ]
  },
  "notes": "外部共有制約を中心にしたケース。専門知識なしでも扱える。"
}
