{
  "task_id": "meeting_001",
  "domain": "meeting_prep",
  "difficulty": "easy",
  "initial_request": "来週の経営定例を準備してください。新しい法人向け料金プランの方向性を決めるための会議で、CEO、営業責任者、プロダクト責任者が参加します。会議アジェンダと事前共有メモを作り、当日中に意思決定できる状態にしたいです。",
  "initial_state": {
    "timezone": "Asia/Tokyo",
    "deadline": "2026-04-10T17:00:00+09:00",
    "participants": ["CEO", "SalesLead", "ProductLead"],
    "budget": 50000,
    "required_artifacts": [
      {
        "artifact_id": "agenda",
        "artifact_type": "document",
        "required_fields": ["meeting_objective", "agenda_items", "owner", "time_allocation"],
        "semantic_checks": [
          {
            "artifact_field": "deadline",
            "state_path": "deadline"
          },
          {
            "artifact_field": "participants",
            "state_path": "participants"
          }
        ]
      },
      {
        "artifact_id": "briefing_doc",
        "artifact_type": "document",
        "required_fields": ["summary", "decision_points", "risks", "next_actions"],
        "semantic_checks": [
          {
            "artifact_field": "deadline",
            "state_path": "deadline"
          },
          {
            "artifact_field": "participants",
            "state_path": "participants"
          }
        ]
      }
    ],
    "constraints": [
      "参加者全員の出席可能時間が確定するまで開始時刻を確定しない",
      "会議時間は30分以内に収める",
      "事前共有メモには料金改定の背景、候補案、想定リスクを含める"
    ],
    "task_dependencies": [
      {
        "before": "collect_availability",
        "after": "propose_schedule",
        "reason": "参加可能時間を確認してから会議時刻を提案する必要がある"
      },
      {
        "before": "define_agenda",
        "after": "write_briefing_doc",
        "reason": "論点を固めてから事前共有メモを書く必要がある"
      }
    ],
    "reference_data": {
      "meeting_type": "executive weekly review",
      "topic": "new enterprise pricing plan",
      "decision_goal": "choose one of three pricing directions",
      "agenda_min_items": 3,
      "known_options": [
        "seat-based pricing",
        "usage-based pricing",
        "hybrid pricing"
      ]
    }
  },
  "allowed_actions": [
    "ask_clarification",
    "propose_plan",
    "update_plan",
    "create_artifact",
    "revise_artifact",
    "confirm_state",
    "finalize"
  ],
  "events": [
    {
      "turn": 3,
      "type": "state_change",
      "message": "FinanceLead も意思決定に参加することになり、経営陣の空き時間都合で締切が前倒しになりました。",
      "delta": {
        "participants_added": ["FinanceLead"],
        "deadline": "2026-04-09T12:00:00+09:00"
      },
      "expected_artifact_updates": ["agenda", "briefing_doc"],
      "expected_replan_within_turns": 2
    }
  ],
  "goal_condition": {
    "must_satisfy_latest_state": true,
    "required_artifacts": ["agenda", "briefing_doc"],
    "no_constraint_violation": true,
    "must_acknowledge_changes": true
  },
  "rubric": {
    "outcome": [
      "最終成果物が FinanceLead 追加と最新締切を反映している",
      "briefing_doc が料金案の比較と意思決定論点を含んでいる",
      "agenda と briefing_doc の参加者・期限が整合している"
    ],
    "process": [
      "参加可能時間確認を会議時刻確定より前に置いている",
      "会議論点を固めてから事前共有メモを作成している"
    ],
    "recovery": [
      "イベント発生後2ターン以内に状態更新または再計画を行う",
      "参加者追加と締切前倒しの両方を明示的に認識している"
    ]
  },
  "notes": "最も基本的なケース。会議目的が明確で、参加者変更と締切前倒しへの追従を確認できる。"
}
